{
  "schema_version": 1,
  "benchmark_version": "cross-host-v1",
  "suite": "cross-host-v1",
  "direction": "claude_to_codex",
  "condition": "remem_shared",
  "task_id": "cc2cx-architecture-decision",
  "run_index": 0,
  "source_host": "claude_code",
  "target_host": "codex",
  "resolved": false,
  "failure_reason": "oracle_inconclusive",
  "metrics": {
    "tokens_total": 0,
    "wall_time_ms": 0,
    "turns": 0,
    "handoff_fact_recall": null,
    "turns_to_first_correct_hypothesis": null,
    "time_to_first_relevant_file_ms": null,
    "repeated_failed_action_count": 0,
    "exported_file_generation_cost_tokens": null,
    "exported_file_maintenance_cost_tokens": null
  },
  "handoff_isolation": {
    "source_home_isolated": true,
    "target_home_isolated": true,
    "source_session_store_readable_by_target": false,
    "leak_scan_passed": true
  },
  "attribution": {
    "source_session_refs": ["example:source-session-ref"],
    "captured_event_refs": ["example:captured-event-ref"],
    "promoted_memory_refs": ["example:promoted-memory-ref"],
    "selected_context_item_refs": ["example:context-item-ref"],
    "cited_refs": [],
    "used_refs": [],
    "origins": [
      { "ref": "example:promoted-memory-ref", "origin": "remem_canonical_capture" }
    ],
    "scope_at_target": "project",
    "validity_at_target": "active"
  },
  "artifacts": {
    "note": "Schema example only. Not a benchmark result; no run has been executed."
  }
}
